{
  "revoked": true,
  "duplicate": false,
  "device": {
    "id": "dev_test_01",
    "user_id": "11111111-1111-4111-8111-111111111111",
    "network_id": "network-golden",
    "name": "Test device",
    "platform": "linux",
    "hostname": "test-device",
    "wireguard_public_key": "AgICAgICAgICAgICAgICAgICAgICAgICAgICAgICAgI=",
    "wireguard_address": "10.77.0.10/32",
    "created_at": "2026-08-28T10:00:00Z",
    "updated_at": "2026-08-28T12:05:00Z",
    "last_seen_at": null,
    "status": "revoked",
    "state_version": 3,
    "key_version": 1,
    "revoked_at": "2026-08-28T12:05:00Z",
    "revoked_reason": "enrollment_leave"
  },
  "policy_reconcile_pending": true
}
